{
  "schemaVersion": 1,
  "viewId": "sample-review",
  "view": "table",
  "title": "Sample: review response components",
  "context": {"goal": "Compare components and return one batch of instructions", "next": "Select items and attach feedback"},
  "columns": [{"key":"name","label":"Component"},{"key":"status","label":"State"},{"key":"effort","label":"Sample effort","type":"number","editable":true}],
  "filterKey": "status",
  "pageSize": 3,
  "rows": [
    {"id":"table","name":"Interactive table","status":"Accepted","effort":1},
    {"id":"cards","name":"Cards","status":"Review","effort":2},
    {"id":"forms","name":"Editable forms","status":"Review","effort":2},
    {"id":"flows","name":"Technical flows","status":"Review","effort":3}
  ]
}
